<!ELEMENT branches (branch+)>
<!ELEMENT branch (address, contact, openingHours, link)>
<!ELEMENT address (#PCDATA)>
<!ELEMENT contact (#PCDATA)>
<!ELEMENT openingHours (#PCDATA)>
<!ELEMENT link (#PCDATA)>
